<?xml version="1.0" ?>
<!DOCTYPE note SYSTEM "document.dtd">
<note date="02-02-2005">
<de/>
<a>Lucrèce</a>
<a>Joséphine</a>
<sujet>Rappel</sujet>
<CMU>
<yes />
</CMU>
<contenu>
N'oublie pas la fête de fin d'exams!
</contenu>
<attache url="http://www.party.com/flyer.jpg"/>
</note>